{
  "schema_version": "1.0.0",
  "lexicon_id": "sample_group_01_terms_ko",
  "language": "ko-KR",
  "source_status": "sample_calibrated",
  "notes": "Derived from four supplied popular Korean webnovel TXT samples. Stores terms and counts only; no source prose is copied.",
  "entries": [
    {
      "id": "group01_term_skill",
      "surface": "스킬",
      "kind": "webnovel_term",
      "category": "system_ability",
      "genres": ["현대판타지", "헌터물", "게임판타지"],
      "allowed_contexts": ["ability_reveal", "system_message", "combat_calculation"],
      "avoid_contexts": ["pure_emotional_confession"],
      "register": "genre_standard",
      "source": "reports/group_01_sample_calibration.json",
      "sample_dependency": true,
      "confidence": 0.94,
      "evidence": ["group_01: document_count=4, count=387"],
      "review_status": "active"
    },
    {
      "id": "group01_term_reward",
      "surface": "보상",
      "kind": "webnovel_term",
      "category": "progression_reward",
      "genres": ["현대판타지", "헌터물", "게임판타지"],
      "allowed_contexts": ["quest_clear", "risk_payoff", "status_message"],
      "register": "genre_standard",
      "source": "reports/group_01_sample_calibration.json",
      "sample_dependency": true,
      "confidence": 0.92,
      "evidence": ["group_01: document_count=4, count=223"],
      "review_status": "active"
    },
    {
      "id": "group01_term_system",
      "surface": "시스템",
      "kind": "webnovel_term",
      "category": "system_ui",
      "genres": ["현대판타지", "헌터물", "게임판타지"],
      "allowed_contexts": ["world_rule", "status_message", "quest_trigger"],
      "avoid_contexts": ["authorial_explanation"],
      "register": "genre_standard",
      "source": "reports/group_01_sample_calibration.json",
      "sample_dependency": true,
      "confidence": 0.92,
      "evidence": ["group_01: document_count=4, count=195"],
      "review_status": "active"
    },
    {
      "id": "group01_term_mana",
      "surface": "마력",
      "kind": "webnovel_term",
      "category": "power_resource",
      "genres": ["판타지", "헌터물", "아카데미물"],
      "allowed_contexts": ["combat_calculation", "training", "resource_limit"],
      "register": "genre_standard",
      "source": "reports/group_01_sample_calibration.json",
      "sample_dependency": true,
      "confidence": 0.86,
      "evidence": ["group_01: document_count=3, count=223"],
      "review_status": "active"
    },
    {
      "id": "group01_term_guild",
      "surface": "길드",
      "kind": "webnovel_term",
      "category": "organization",
      "genres": ["현대판타지", "헌터물", "게임판타지"],
      "allowed_contexts": ["faction", "mission", "ranking", "economy"],
      "register": "genre_standard",
      "source": "reports/group_01_sample_calibration.json",
      "sample_dependency": true,
      "confidence": 0.86,
      "evidence": ["group_01: document_count=3, count=203"],
      "review_status": "active"
    },
    {
      "id": "group01_term_quest",
      "surface": "퀘스트",
      "kind": "webnovel_term",
      "category": "system_objective",
      "genres": ["현대판타지", "헌터물", "게임판타지"],
      "allowed_contexts": ["objective", "reward", "choice_pressure"],
      "register": "genre_standard",
      "source": "reports/group_01_sample_calibration.json",
      "sample_dependency": true,
      "confidence": 0.86,
      "evidence": ["group_01: document_count=3, count=158"],
      "review_status": "active"
    },
    {
      "id": "group01_term_gate",
      "surface": "게이트",
      "kind": "webnovel_term",
      "category": "setting_portal",
      "genres": ["현대판타지", "헌터물"],
      "allowed_contexts": ["threat", "mission", "public_incident"],
      "synonyms": ["균열"],
      "register": "genre_standard",
      "source": "reports/group_01_sample_calibration.json",
      "sample_dependency": true,
      "confidence": 0.86,
      "evidence": ["group_01: document_count=3, count=158"],
      "review_status": "active"
    },
    {
      "id": "group01_term_rank",
      "surface": "랭킹",
      "kind": "webnovel_term",
      "category": "status_hierarchy",
      "genres": ["현대판타지", "헌터물", "게임판타지"],
      "allowed_contexts": ["ranking", "public_evaluation", "competition"],
      "register": "genre_standard",
      "source": "reports/group_01_sample_calibration.json",
      "sample_dependency": true,
      "confidence": 0.82,
      "evidence": ["group_01: document_count=3, count=89"],
      "review_status": "active"
    },
    {
      "id": "group01_term_awakener",
      "surface": "각성자",
      "kind": "genre_term",
      "category": "role",
      "genres": ["현대판타지", "헌터물"],
      "allowed_contexts": ["occupation", "ranking", "social_class"],
      "synonyms": ["헌터"],
      "register": "genre_standard",
      "source": "reports/group_01_sample_calibration.json",
      "sample_dependency": true,
      "confidence": 0.86,
      "evidence": ["group_01: document_count=3, count=140"],
      "review_status": "active"
    },
    {
      "id": "group01_term_guild_battle",
      "surface": "길드전",
      "kind": "genre_term",
      "category": "competition_event",
      "genres": ["현대판타지", "헌터물", "게임판타지"],
      "allowed_contexts": ["tournament", "faction_conflict", "ranking_payoff"],
      "register": "genre_standard",
      "source": "reports/group_01_sample_calibration.json",
      "sample_dependency": true,
      "confidence": 0.64,
      "evidence": ["group_01: document_count=1, count=105"],
      "review_status": "candidate"
    },
    {
      "id": "group01_term_returner",
      "surface": "회귀자",
      "kind": "genre_term",
      "category": "premise_role",
      "genres": ["회귀물", "현대판타지"],
      "allowed_contexts": ["premise", "memory_advantage", "choice_reason"],
      "register": "genre_standard",
      "source": "reports/group_01_sample_calibration.json",
      "sample_dependency": true,
      "confidence": 0.62,
      "evidence": ["group_01: document_count=1, count=50"],
      "review_status": "candidate"
    }
  ]
}
