{
  "schema_version": "1.0.0",
  "lexicon_id": "ai_tell_phrases_ko",
  "language": "ko-KR",
  "source_status": "sample_calibrated",
  "notes": "im-not-ai의 10대 AI-tell 분류를 웹소설 원고 검사에 맞게 축약한 뒤 group_01 인기작 TXT 4개로 오탐 가능성을 보정했다. 일반 문법형은 S2 밀도 경고로, 메타/요약형은 S1 차단으로 유지한다.",
  "entries": [
    {
      "id": "ai_tell_through",
      "surface": "통해",
      "kind": "ai_tell_phrase",
      "category": "A_translationese",
      "severity": "S2",
      "match_type": "substring",
      "replacement": "문맥에 따라 '로', '에서', 동사형 표현으로 분산",
      "threshold": 25,
      "source": "im-not-ai quick-rules A-2; reports/group_01_sample_calibration.json",
      "sample_dependency": true,
      "confidence": 0.66,
      "evidence": ["group_01: document_count=4, total_count=133"],
      "review_status": "active",
      "notes": "샘플에서 일반 문법으로 자주 관찰되어 단순 S1 차단은 오탐 위험이 높다. 반복 밀도와 번역투 문맥을 함께 본다."
    },
    {
      "id": "ai_tell_in_terms",
      "surface": "에 있어",
      "kind": "ai_tell_phrase",
      "category": "A_translationese",
      "severity": "S2",
      "match_type": "substring",
      "replacement": "'에서', '보면', 또는 직접 서술로 수정",
      "threshold": 8,
      "source": "im-not-ai quick-rules A-3; reports/group_01_sample_calibration.json",
      "sample_dependency": true,
      "confidence": 0.68,
      "evidence": ["group_01: document_count=3, total_count=20"],
      "review_status": "active"
    },
    {
      "id": "ai_tell_have",
      "surface": "가지고 있다",
      "kind": "ai_tell_phrase",
      "category": "A_translationese",
      "severity": "S2",
      "match_type": "substring",
      "replacement": "'있다', 형용사형, 또는 구체 행동으로 환원",
      "threshold": 6,
      "source": "im-not-ai quick-rules A-7; reports/group_01_sample_calibration.json",
      "sample_dependency": true,
      "confidence": 0.7,
      "evidence": ["group_01: document_count=4, total_count=17"],
      "review_status": "active"
    },
    {
      "id": "ai_tell_conclusion",
      "surface": "결론적으로",
      "kind": "ai_tell_phrase",
      "category": "D_signature_phrase",
      "severity": "S1",
      "match_type": "substring",
      "replacement": "삭제하거나 장면의 행동/판단으로 대체",
      "threshold": 2,
      "source": "im-not-ai quick-rules D-1; reports/group_01_sample_calibration.json",
      "sample_dependency": true,
      "confidence": 0.84,
      "evidence": ["group_01: document_count=3, total_count=4"],
      "review_status": "active"
    },
    {
      "id": "ai_tell_summary",
      "surface": "요약하면",
      "kind": "ai_tell_phrase",
      "category": "D_signature_phrase",
      "severity": "S1",
      "match_type": "substring",
      "replacement": "삭제하거나 인물의 판단으로 압축",
      "threshold": 2,
      "source": "im-not-ai quick-rules D-1; reports/group_01_sample_calibration.json",
      "sample_dependency": true,
      "confidence": 0.84,
      "evidence": ["group_01: document_count=2, total_count=4"],
      "review_status": "active"
    },
    {
      "id": "ai_tell_noteworthy",
      "surface": "주목할 만하다",
      "kind": "ai_tell_phrase",
      "category": "D_signature_phrase",
      "severity": "S1",
      "match_type": "substring",
      "replacement": "구체 결과, 위험, 선택 비용으로 대체",
      "threshold": 1,
      "source": "im-not-ai quick-rules D-2",
      "sample_dependency": false,
      "confidence": 0.84,
      "review_status": "active"
    },
    {
      "id": "ai_tell_will_be",
      "surface": "것이다",
      "kind": "ai_tell_phrase",
      "category": "I_formal_noun",
      "severity": "S2",
      "match_type": "substring",
      "replacement": "단정형 종결 또는 인물의 직접 판단으로 수정",
      "threshold": 80,
      "source": "im-not-ai quick-rules I-1; reports/group_01_sample_calibration.json",
      "sample_dependency": true,
      "confidence": 0.62,
      "evidence": ["group_01: document_count=4, total_count=342"],
      "review_status": "active",
      "notes": "인기작 장문 샘플에서 넓게 관찰된다. 단문 원고에서는 밀도와 주변 문체를 함께 확인한다."
    },
    {
      "id": "ai_tell_ordered_list",
      "surface": "첫째",
      "kind": "ai_tell_phrase",
      "category": "C_structure",
      "severity": "S2",
      "match_type": "substring",
      "replacement": "웹소설 본문에서는 행동 흐름으로 흡수",
      "threshold": 5,
      "source": "im-not-ai quick-rules C-1; reports/group_01_sample_calibration.json",
      "sample_dependency": true,
      "confidence": 0.68,
      "evidence": ["group_01: document_count=4, total_count=17"],
      "review_status": "active"
    },
    {
      "id": "ai_tell_markdown_bold",
      "surface": "\\*\\*[^*]+\\*\\*",
      "kind": "ai_tell_phrase",
      "category": "J_visual_format",
      "severity": "S2",
      "match_type": "regex",
      "replacement": "본문에서는 굵게 표시 대신 문장 리듬과 행갈이로 강조",
      "threshold": 1,
      "source": "im-not-ai quick-rules J-1",
      "sample_dependency": false,
      "confidence": 0.8,
      "review_status": "active"
    }
  ]
}
