{
  "schema_version": "1.0.0",
  "lexicon_id": "sample_group_01_voice_ko",
  "language": "ko-KR",
  "source_status": "sample_calibrated",
  "notes": "Derived dialogue and narration markers from group_01 samples. These are corpus-level voice candidates, not character-specific profiles.",
  "entries": [
    {
      "id": "group01_voice_narration_past_plain",
      "surface": "있었다",
      "kind": "style_marker",
      "category": "narration_ending_frequency",
      "allowed_contexts": ["narration", "scene_state", "aftermath"],
      "register": "plain_past",
      "source": "reports/group_01_sample_calibration.json",
      "sample_dependency": true,
      "confidence": 0.9,
      "evidence": ["group_01: narration ending count=2067"],
      "review_status": "active",
      "notes": "High-frequency narration marker; audit for monotony when clustered."
    },
    {
      "id": "group01_voice_narration_action_completed",
      "surface": "했다",
      "kind": "style_marker",
      "category": "narration_ending_frequency",
      "allowed_contexts": ["action_resolution", "beat_transition"],
      "register": "plain_past",
      "source": "reports/group_01_sample_calibration.json",
      "sample_dependency": true,
      "confidence": 0.86,
      "evidence": ["group_01: narration ending count=794"],
      "review_status": "active"
    },
    {
      "id": "group01_voice_narration_negative_past",
      "surface": "않았다",
      "kind": "style_marker",
      "category": "narration_ending_frequency",
      "allowed_contexts": ["refusal", "failed_expectation", "contrast"],
      "register": "plain_past",
      "source": "reports/group_01_sample_calibration.json",
      "sample_dependency": true,
      "confidence": 0.86,
      "evidence": ["group_01: narration ending count=694"],
      "review_status": "active"
    },
    {
      "id": "group01_voice_narration_start_beat",
      "surface": "시작했다",
      "kind": "style_marker",
      "category": "narration_ending_frequency",
      "allowed_contexts": ["sequence_open", "combat_escalation", "training"],
      "register": "plain_past",
      "source": "reports/group_01_sample_calibration.json",
      "sample_dependency": true,
      "confidence": 0.82,
      "evidence": ["group_01: narration ending count=433"],
      "review_status": "active"
    },
    {
      "id": "group01_voice_dialogue_polite_question",
      "surface": "겁니까",
      "kind": "character_voice_rule",
      "category": "dialogue_ending",
      "allowed_contexts": ["polite_question", "hierarchy", "formal_conflict"],
      "register": "formal_question",
      "source": "reports/group_01_sample_calibration.json",
      "sample_dependency": true,
      "confidence": 0.76,
      "evidence": ["group_01: dialogue ending count=36"],
      "review_status": "active"
    },
    {
      "id": "group01_voice_dialogue_casual_future",
      "surface": "거야",
      "kind": "character_voice_rule",
      "category": "dialogue_ending",
      "allowed_contexts": ["casual_statement", "resolve", "banter"],
      "register": "casual",
      "source": "reports/group_01_sample_calibration.json",
      "sample_dependency": true,
      "confidence": 0.78,
      "evidence": ["group_01: dialogue ending count=44"],
      "review_status": "active"
    },
    {
      "id": "group01_voice_dialogue_confirm_formal",
      "surface": "알겠습니다",
      "kind": "character_voice_rule",
      "category": "dialogue_ending",
      "allowed_contexts": ["obedience", "military_or_hierarchy", "formal_reply"],
      "register": "formal",
      "source": "reports/group_01_sample_calibration.json",
      "sample_dependency": true,
      "confidence": 0.74,
      "evidence": ["group_01: dialogue ending count=29"],
      "review_status": "active"
    },
    {
      "id": "group01_voice_address_master",
      "surface": "마스터",
      "kind": "character_voice_rule",
      "category": "address_term",
      "allowed_contexts": ["subordinate_address", "summoned_entity", "game_system_tone"],
      "register": "hierarchical_address",
      "source": "reports/group_01_sample_calibration.json",
      "sample_dependency": true,
      "confidence": 0.74,
      "evidence": ["group_01: dialogue marker count=29"],
      "review_status": "candidate"
    },
    {
      "id": "group01_voice_address_lord",
      "surface": "주군",
      "kind": "character_voice_rule",
      "category": "address_term",
      "allowed_contexts": ["retainer_address", "fantasy_hierarchy", "loyalty_scene"],
      "register": "archaic_hierarchical",
      "source": "reports/group_01_sample_calibration.json",
      "sample_dependency": true,
      "confidence": 0.76,
      "evidence": ["group_01: dialogue marker count=37"],
      "review_status": "candidate"
    },
    {
      "id": "group01_voice_dialogue_casual_challenge",
      "surface": "거냐",
      "kind": "character_voice_rule",
      "category": "dialogue_ending",
      "allowed_contexts": ["challenge", "suspicion", "casual_conflict"],
      "register": "casual_blunt",
      "source": "reports/group_01_sample_calibration.json",
      "sample_dependency": true,
      "confidence": 0.72,
      "evidence": ["group_01: dialogue ending count=21"],
      "review_status": "active"
    }
  ]
}
